{
  "colors": {
    "primary": "#2563eb",
    "primary-hover": "#1d4ed8",
    "primary-light": "#dbeafe",
    "primary-dark": "#0b0b60",
    "secondary": "#64748b",
    "secondary-hover": "#475569",
    "secondary-dark": "#3B4E68",
    "accent": "#10b981",
    "accent-hover": "#059669",
    "accent-light": "#14EBA3",
    "accent-dark": "#0D9668",
    "text": "#1f2937",
    "text-light": "#374151",
    "text-muted": "#6b7280",
    "text-inverse": "#ffffff",
    "background": "#ffffff",
    "background-secondary": "#f9fafb",
    "background-tertiary": "#E6F2FC",
    "surface": "#F7FCFF",
    "surface-hover": "#f3f4f6",
    "surface-secondary": "#F0F3FF",
    "surface-dark": "#D9DCE2",
    "border": "#e5e7eb",
    "border-light": "#f3f4f6",
    "border-dark": "#d1d5db",
    "success": "#10b981",
    "success-light": "#d1fae5",
    "success-dark": "#065f46",
    "error": "#ef4444",
    "error-light": "#fee2e2",
    "warning": "#f59e0b",
    "warning-light": "#fef3c7",
    "warning-dark": "#92400e",
    "info": "#3b82f6",
    "info-light": "#dbeafe",
    "info-dark": "#1e40af",
    "overlay": "rgba(0, 0, 0, 0.5)",
    "secondary-light": "#8A9FBD",
    "shadow": "rgba(31, 41, 55, 0.08)"
  },
  "dark": {
    "background": "#111827",
    "background-secondary": "#1F2937",
    "background-tertiary": "#374151",
    "surface": "#1F2937",
    "surface-secondary": "#374151",
    "surface-hover": "#4B5563",
    "text": "#F9FAFB",
    "text-light": "#D1D5DB",
    "text-muted": "#9CA3AF",
    "text-inverse": "#1f2937",
    "border": "#374151",
    "border-light": "#4B5563",
    "border-dark": "#1F2937",
    "primary-light": "#1e3a5f",
    "success-light": "#065f46",
    "error-light": "#7f1d1d",
    "warning-light": "#78350f",
    "info-light": "#1e3a5f",
    "overlay": "rgba(0, 0, 0, 0.7)",
    "shadow-sm": "0 1px 2px 0 rgba(0, 0, 0, 0.3)",
    "shadow-base": "0 1px 3px 0 rgba(0, 0, 0, 0.4), 0 1px 2px -1px rgba(0, 0, 0, 0.3)",
    "shadow-md": "0 4px 6px -1px rgba(0, 0, 0, 0.4), 0 2px 4px -2px rgba(0, 0, 0, 0.3)",
    "shadow-lg": "0 10px 15px -3px rgba(0, 0, 0, 0.4), 0 4px 6px -4px rgba(0, 0, 0, 0.3)",
    "shadow-xl": "0 20px 25px -5px rgba(0, 0, 0, 0.4), 0 8px 10px -6px rgba(0, 0, 0, 0.3)"
  },
  "typography": {
    "font-family-body": "system-ui, -apple-system, BlinkMacSystemFont, 'Segoe UI', Roboto, 'Helvetica Neue', Arial, sans-serif",
    "font-family-heading": "system-ui, -apple-system, BlinkMacSystemFont, 'Segoe UI', Roboto, 'Helvetica Neue', Arial, sans-serif",
    "font-sans": "system-ui, -apple-system, BlinkMacSystemFont, 'Segoe UI', Roboto, 'Helvetica Neue', Arial, sans-serif",
    "font-serif": "Georgia, 'Times New Roman', serif",
    "font-mono": "ui-monospace, SFMono-Regular, 'SF Mono', Menlo, Consolas, monospace",
    "font-size-xs": "0.75rem",
    "font-size-sm": "0.875rem",
    "font-size-base": "1rem",
    "font-size-lg": "1.125rem",
    "font-size-xl": "1.25rem",
    "font-size-2xl": "1.5rem",
    "font-size-3xl": "1.875rem",
    "font-size-4xl": "2.25rem",
    "font-size-5xl": "3rem",
    "font-weight-normal": "400",
    "font-weight-medium": "500",
    "font-weight-semibold": "600",
    "font-weight-bold": "700",
    "line-height-tight": "1.25",
    "line-height-normal": "1.5",
    "line-height-relaxed": "1.625",
    "letter-spacing-tight": "-0.025em",
    "letter-spacing-normal": "0",
    "letter-spacing-wide": "0.025em",
    "word-spacing-tight": "-0.05em",
    "word-spacing-normal": "0",
    "word-spacing-wide": "0.1em",
    "text-indent-none": "0",
    "text-indent-sm": "1em",
    "text-indent-md": "2em",
    "text-indent-lg": "3em",
    "font-variant-normal": "normal",
    "font-variant-small-caps": "small-caps",
    "font-variant-all-small-caps": "all-small-caps",
    "text-decoration-none": "none",
    "text-decoration-underline": "underline",
    "text-decoration-line-through": "line-through",
    "text-align-left": "left",
    "text-align-center": "center",
    "text-align-right": "right",
    "text-align-justify": "justify",
    "vertical-align-baseline": "baseline",
    "vertical-align-top": "top",
    "vertical-align-middle": "middle",
    "vertical-align-bottom": "bottom",
    "direction-ltr": "ltr",
    "direction-rtl": "rtl",
    "line-height-base": "1.5"
  },
  "spacing": {
    "0": "0",
    "1": "0.25rem",
    "2": "0.5rem",
    "3": "0.75rem",
    "4": "1rem",
    "5": "1.25rem",
    "6": "1.5rem",
    "8": "2rem",
    "10": "2.5rem",
    "12": "3rem",
    "16": "4rem",
    "20": "5rem",
    "24": "6rem"
  },
  "borders": {
    "width-0": "0",
    "width-1": "1px",
    "width-2": "2px",
    "radius-none": "0",
    "radius-sm": "0.25rem",
    "radius-base": "0.375rem",
    "radius-md": "0.5rem",
    "radius-lg": "0.75rem",
    "radius-xl": "1rem",
    "radius-full": "9999px"
  },
  "shadows": {
    "none": "none",
    "sm": "0 1px 2px 0 rgba(0, 0, 0, 0.05)",
    "base": "0 1px 3px 0 rgba(0, 0, 0, 0.1), 0 1px 2px -1px rgba(0, 0, 0, 0.1)",
    "md": "0 4px 6px -1px rgba(0, 0, 0, 0.1), 0 2px 4px -2px rgba(0, 0, 0, 0.1)",
    "lg": "0 10px 15px -3px rgba(0, 0, 0, 0.1), 0 4px 6px -4px rgba(0, 0, 0, 0.1)",
    "xl": "0 20px 25px -5px rgba(0, 0, 0, 0.1), 0 8px 10px -6px rgba(0, 0, 0, 0.1)"
  },
  "transitions": {
    "duration-fast": "150ms",
    "duration-base": "200ms",
    "duration-slow": "300ms",
    "easing-default": "cubic-bezier(0.4, 0, 0.2, 1)",
    "easing-in": "cubic-bezier(0.4, 0, 1, 1)",
    "easing-out": "cubic-bezier(0, 0, 0.2, 1)"
  },
  "breakpoints": {
    "sm": "640px",
    "md": "768px",
    "lg": "1024px",
    "xl": "1280px",
    "2xl": "1536px"
  },
  "responsive": {
    "scale-mobile-text": "0.875",
    "scale-mobile-space": "0.75",
    "scale-mobile-padding": "0.667"
  },
  "z-index": {
    "dropdown": "1000",
    "sticky": "1020",
    "fixed": "1030",
    "modal-backdrop": "1040",
    "modal": "1050",
    "popover": "1060",
    "tooltip": "1070"
  },
  "container": {
    "max-width": "1280px",
    "padding": "1rem"
  },
  "menu": {
    "text-color": "var(--theme-color-text)",
    "text-hover-color": "var(--theme-color-text-inverse)",
    "background": "transparent",
    "background-hover": "var(--theme-color-primary)",
    "dropdown-background": "var(--theme-color-surface)",
    "dropdown-shadow": "var(--theme-shadow-lg)",
    "border-color": "var(--theme-color-border)",
    "active-indicator-color": "var(--theme-color-primary)",
    "item-gap": "var(--theme-space-1)",
    "link-padding-x": "var(--theme-space-4)",
    "link-padding-y": "var(--theme-space-2)",
    "dropdown-padding": "var(--theme-space-2)",
    "dropdown-offset": "var(--theme-space-2)",
    "font-size": "var(--theme-font-size-base)",
    "font-weight": "var(--theme-font-weight-medium)",
    "font-weight-active": "var(--theme-font-weight-semibold)",
    "border-radius": "var(--theme-radius-md)",
    "dropdown-border-radius": "var(--theme-radius-lg)",
    "animation-duration": "var(--theme-transition-duration-fast)",
    "animation-timing": "var(--theme-transition-easing-default)",
    "slide-duration": "var(--theme-transition-duration-slow)"
  },
  "header": {
    "background": "var(--theme-color-surface)",
    "text-color": "var(--theme-color-text)",
    "border-color": "var(--theme-color-border)",
    "link-color": "var(--theme-color-text)",
    "link-hover-color": "var(--theme-color-primary)",
    "padding-y": "var(--theme-space-4)",
    "padding-x": "var(--theme-space-4)",
    "logo-height": "40px",
    "icon-size": "1.25rem",
    "icon-color": "var(--theme-color-text)",
    "icon-hover-color": "var(--theme-color-primary)",
    "zones": {
      "top-bar": {
        "background": "var(--theme-header-background)",
        "background-promotional": "var(--theme-header-zones-top-bar-background)",
        "background-boutique": "var(--theme-header-zones-top-bar-background)",
        "background-split": "var(--theme-header-zones-top-bar-background)",
        "background-classic": "var(--theme-header-zones-top-bar-background)",
        "background-mega": "var(--theme-header-zones-top-bar-background)",
        "background-minimal": "var(--theme-header-zones-top-bar-background)",
        "text-color": "var(--theme-color-text-muted)",
        "text-color-promotional": "var(--theme-header-zones-top-bar-text-color)",
        "text-color-boutique": "var(--theme-header-zones-top-bar-text-color)",
        "text-color-split": "var(--theme-header-zones-top-bar-text-color)",
        "text-color-classic": "var(--theme-header-zones-top-bar-text-color)",
        "text-color-mega": "var(--theme-header-zones-top-bar-text-color)",
        "text-color-minimal": "var(--theme-header-zones-top-bar-text-color)",
        "border-color": "var(--theme-color-border)",
        "border-color-promotional": "var(--theme-header-zones-top-bar-border-color)",
        "border-color-boutique": "var(--theme-header-zones-top-bar-border-color)",
        "border-color-split": "var(--theme-header-zones-top-bar-border-color)",
        "border-color-classic": "var(--theme-header-zones-top-bar-border-color)",
        "border-color-mega": "var(--theme-header-zones-top-bar-border-color)",
        "border-color-minimal": "var(--theme-header-zones-top-bar-border-color)",
        "height": "70px",
        "height-promotional": "var(--theme-header-zones-top-bar-height)",
        "height-boutique": "var(--theme-header-zones-top-bar-height)",
        "height-split": "var(--theme-header-zones-top-bar-height)",
        "height-classic": "var(--theme-header-zones-top-bar-height)",
        "height-mega": "var(--theme-header-zones-top-bar-height)",
        "height-minimal": "var(--theme-header-zones-top-bar-height)",
        "padding-y": "var(--theme-space-4)",
        "padding-y-promotional": "var(--theme-header-zones-top-bar-padding-y)",
        "padding-y-boutique": "var(--theme-header-zones-top-bar-padding-y)",
        "padding-y-split": "var(--theme-header-zones-top-bar-padding-y)",